Requirement,Type
as a patient i want to be able to share data which is collected through my wearable devices with healthcare professionals,PO
as a patient i want to be able to view prescriptions on a mobile device,PO
as a remote employee i need the work application to be operable on various internet speeds,PO
as a remote worker i want the collaboration tool to work seamlessly across different devices so that i can work from anywhere,PO
as a software developer i want the application to be easily portable across different operating systems,PO
as a student i want the catalog system to be accessible on my smartphone so that i can use it anytime anywhere,PO
as a student i want the cms to be accessible on multiple devices so that i can study anywhere whether on my laptop tablet or phone,PO
as a student i want the educational platform to be accessible on multiple devices so that i can study anywhere,PO
as a student i want to be able to access course materials and resources on my mobile device so that i can study on the go,PO
as a student i want to be able to access course materials from my mobile device so that i can study on the go,PO
as a teacher i want the system to be accessible from various devices so that i can work on student assessments from anywhere,PO
as a team manager i want to be able to access the system from a desktop so that i make fewer mistakes when managing my assets,PO
as a team staff member i want to be able to access the system from a desktop so that i more easily work together with other staff members,PO
as a traveler with diabetes i want the device to be usable in different climates and altitudes so that i can manage my diabetes anywhere i go,PO
as a traveller i want the booking app to offer support in multiple languages so that i can use it in my native language,PO
as a umd employee i want the software to be able to reach from remote computers so that my employees can work from home,PO
as a user i want the app to be available in different languages so that i can use it in my native language for better understanding,PO
as a user i want the app to be available in multiple languages so that nonnative speakers can also use it easily,PO
as a user i want the app to support casting to larger screens so that i can view videos and live games on my tv,PO
as a user i want the app to support multiple languages so that i can chat in my preferred language,PO
as a user i want the app to work across different devices so that i can access my chats from anywhere,PO
as a user i want the app to work on both ios and android devices so that i can use it regardless of my phone,PO
as a user i want the application to run on both ios and android platforms,PO
as a user i want the platform to be accessible on various devices so that i can work on my research from anywhere,PO
as a user i want the site to be accessible on mobile devices so that i can shop on the go,PO
as a user i want to access my account from different devices so that i can manage my profile from anywhere,PO
as a user i want to be able to access news articles in multiple languages,PO
as a user i want to be able to access news articles on different devices,PO
as a user i want to be able to access the service from both a website and a mobile app so that i can use it on multiple devices,PO
as a user i want to be able to access the site and do all the other stuffs on all of my electronic devices,PO
as a user i want to be able to access the system from different devices mobile phone tablets computers etc so that i can use whatever is available to access the software,PO
as a user i want to be able to sync my ebooks across devices so that i can pick up where i left off on any device,PO
as a user i want to have cloud storage integration so that i can save and access my converted files from different devices,PO
as a web user i want the site to be responsive on all browsers so that i can access it from any device,PO
as a webmaster i want the website to be responsive on all devices and screen sizes,PO
as an event organizer i need the app to adapt to different event types and sizes,PO
as an hr manager i want the system to be accessible from both desktop and mobile devices so that i can manage payroll tasks on the go,PO
as an hr manager i want the system to support multiple currencies so that we can manage payroll for employees in different countries,PO
as an ifa employee i want to be able to access the system from a desktop so that i can more easily enter new data into the system,PO
as an international student i want the cms to be available in multiple languages so that i can navigate it in my native language,PO
as an international user i want the application to support multiple languages,PO
as an international user i want the software to support different date formats and cultural norms,PO
as an international user i want the software to support multiple currencies and time zones,PO
as an it manager i want the system to be accessible on different operating systems and browsers so that all staff members can use it regardless of their device,PO
as ifa i want the system to be localizable so that it can accommodate different local regulations languages currencies and time zone,PO
as medical staff member i want to have access to appointment data through any handheld devices so that i can do my work more efficiently,PO
as medical staff member i want to have access to patient data through any handheld devices so that i can do my work more efficiently,PO
as medical staff member i want to have access to room scheduling through any handheld devices so that i can do my work more efficiently,PO
as the ifa i want the system to be able to handle multiple languages so that i can service leagues in different countries,PO
as a business owner I want the service to be run on any device type or hardware or browser or operating system so that I achieve the highest customer base shortly,PO
"As a admin, I want flexibility to switch between different infrastructures.",PO
"As a analyst, I need the ability to migrate data between setups.",PO
"As a analyst, I want the system to work in different environments.",PO
"As a end-user, I need to migrate the application to cloud infrastructure easily.",PO
"As a analyst, I want the software to be portable across different operating systems to maximize flexibility.",PO
"As a manager, I want the system to run on both Windows and Linux without modifications.",PO
"As a developer, I want the system to run on both Windows and Linux without modifications.",PO
"As a user, I want the app to work both online and offline, so that I can use it in any situation.",PO
"As a remote worker, I want to install the app on different devices easily, so that I stay productive.",PO
"As a hiker, I want my outdoor app to adapt to local GPS services, so that I get accurate readings.",PO
"As a mobile user, I want the app to adjust to my screen size, so that it‚Äö√Ñ√¥s easy to use.",PO
"As an organizer, I want my app to support regional date formats, so that it matches local preferences.",PO
"As a system administrator, I want the application to work in various web browsers, so that users have flexibility.",PO
"As a tester, I want the system to support multiple languages, so that international users are accommodated.",PO
"As a manager, I want the application to run on different operating systems, so that users have flexibility.",PO
"As a end-user, I need the system to support containerization, so that deployment is simplified.",PO
"As a business analyst, I need the application to be cloud-agnostic, so that we can switch providers easily.",PO
"As a tester, I need localization support, so that users from different regions are accommodated.",PO
"As a database administrator, I want the system to run on various hardware configurations, so that it meets diverse needs.",PO
"As a security officer, I need compatibility tests for major platforms, so that portability issues are minimized.",PO
"As a user, I want the app to work on both my phone and tablet so that I can use it on any device.",PO
"As a student, I want the online class to be accessible on different devices so that I can study anywhere.",PO
"As a user, I want the app to work with different operating systems so that I can use it on any device.",PO
"As a user, I want the app to support various languages so that I can use it in my preferred language.",PO
"As a user, I want the app to work offline so that I can use it without an internet connection.",PO
"As a developer, I want the app to support containerization so that it runs consistently across environments.",PO
"As a user, I want the app to run on different screen sizes so that it works on any device.",PO
"As a user, I want the app to support different input methods so that I can use touch, keyboard, or mouse.",PO
"As a user, I want the app to be installable via app stores so that I can download it easily.",PO
"As a user, I want the app to migrate data from older versions so that I don't lose information.",PO
"As a user, I want the app to sync data across devices so that I have a consistent experience.",PO
"As a user, I want the app to run on different operating systems so that I can use it on any platform.",PO
"As a user, I want the app to be installable with a single click so that I can set it up easily.",PO
"As a user, I want the app to work with different network conditions so that it functions well on varying internet speeds.",PO
"As a user, I want the app to support multiple user profiles so that different users can share the same device.",PO
"As a user, I want the app to provide a migration tool so that I can move data to a new device easily.",PO
"As a user, I want the app to run in different environments so that it works on both desktop and mobile.",PO
"As a user, I want the app to be available in multiple languages so that it can be used globally.",PO
"As a user, I want the app to support multiple accounts so that I can switch between them easily.",PO
"As a user, I want the app to have a lightweight version so that it can run on older devices.",PO
"As a user, I want the app to use universal design principles so that it works for everyone.",PO
"As a  user, I want the app to adjust to phone and tablet screens so that I can use it anywhere.",PO
"As a  traveler, I want apps to auto-detect language so that I can use them abroad.",PO
"As a  gamer, I want save files to transfer to new consoles so that I keep progress.",PO
"As a  doctor, I want apps to run on basic phones so that rural patients can use them.",PO
"As a  user, I want apps to adjust to screen sizes so that I can use them on any device.",PO
"As a  traveler, I want my travel app to adjust currency and language automatically so that I can use it anywhere.",PO
"As a  gamer, I want my game saves to transfer between devices so that I can play anywhere.",PO
"As a  teacher, I want my lesson plans to export to different formats so that I can share them easily.",PO
"As a  parent, I want parental controls to sync across devices so that I can manage screen time consistently.",PO
"As a user, I want the system to prioritize critical tasks (e.g., payments) over background processes.",PO
"As a user, I want the mobile app to function offline and sync data once reconnected.",PO
"As a user, I want the app to adjust its layout for both 4K monitors and mobile screens.",PO
"As a user, I want the app to run on Windows, macOS, and Linux without separate builds.",PO
"As a traveler, I want the app to adjust date/time formats based on my location.",PO
"As a developer, I want Docker containers to deploy the app across cloud providers.",PO
"As an admin, I want the system to migrate data from legacy databases seamlessly.",PO
"As a customer, I want the app to function identically on iOS and Android devices.",PO
"As a user, I want configuration files to customize settings for different regions.",PO
"As a  developer, I want apps to run on both ARM and x86 processors without recompiling.",PO
"As a  student, I want e-learning platforms to work offline and sync progress later.",PO
"As a  therapist, I want telehealth apps to function on low-end smartphones and tablets.",PO
"As a  traveler, I want travel apps to adjust currency and language based on my location.",PO
"As a  user, I want apps to adjust UI layouts for both 4K monitors and mobile screens.",PO
"As a user, I want to access the application from my phone and my laptop so that I can use it conveniently.",PO
"As a user, I want to access the application from any device so that I can use it conveniently.",PO
"As a user, I want the application to work on different operating systems so that I can use it regardless of my computer.",PO
"As a user, I want the application to be available in my language so that I can understand it easily.",PO
"As a user, I want the application to be accessible to everyone so that people with disabilities can use it.",PO
"As a user, I want to use the application anywhere in the world so that I can access it while traveling.",PO
"As a system administrator, I want to install the application on any server so that I have flexibility in my infrastructure.",PO
"As a developer, I want to deploy the application easily to different environments so that I can release it quickly.",PO
"As a user, I want the application to look good on different screen sizes so that I have a consistent user experience.",PO
"As a system administrator, I want to configure the application easily for different regions so that it can be adapted to local requirements.",PO
"As a user, I want the application to be accessible on different devices (desktop, laptop, tablet), so I can use it from anywhere.",PO
"As a system administrator, I want to be able to deploy the application on different operating systems (Windows, Linux), so I can choose the best platform for our needs.",PO
"As a user, I want the application to be available in multiple languages, so I can use it in my native language.",PO
"As a system administrator, I want to be able to easily install and configure the application on different environments (development, testing, production).",PO
"As a user, I want the application to be responsive and fast, so I don't have to wait for pages to load.",PO
"As a user, I want the application to be accessible on different devices and screen sizes, so I can use it comfortably regardless of my device.",PO
"As a system administrator, I want to be able to easily configure the application for different environments, so I can deploy it seamlessly.",PO
"As a system administrator, I want to be able to easily deploy the application to different environments, so I can manage the application lifecycle effectively.",PO
"As a user, I want the application to work seamlessly across different operating systems (Windows, macOS, Linux).",PO
"As a user, I want to be able to access the application from any device with an internet connection.",PO
"As a mobile user, I want the application to be responsive and adapt to different screen sizes.",PO
"As a user, I want the application to be available in multiple languages.",PO
"As a system administrator, I want to be able to deploy the application on different operating systems (Windows, Linux, macOS).",PO
"As a developer, I want the application to be easily installable on different environments.",PO
as a busy professional i want the app to provide a reliable reminder system for my upcoming donation appointments so that i never miss a donation due to my schedule,RL
as a energy saver i want a device that cools down any of my electronic devices so that they wont overheat,RL
as a healthcare provider i want the device to maintain a high level of accuracy over time so that patients can rely on their readings for making health decisions,RL
as a user i want the app to keep my data accurate and uptodate,RL
as an administrator i want to backup and restore the rulebase so that duo doesnt lose production knowledge,RL
"As a caregiver, I want caregiving apps to reliably track and manage the care of my loved ones.",RL
as ifa i want the system development implementation and maintenance to be outsourced,RL
"As a security officer, I need refactoring to be part of the development process, so that code quality is sustained.",RL
"As a developer, I want the system to be scalable to handle future growth.",RL
as a developer i want d files generation requests to be managed and cached so that duplicate requests do not cause performance issues,RL
as a donor i want the app to maintain a high level of performance during emergency situations so that it doesnt crash when its needed the most,RL
as a renter i want my drains to be automatically cleaned regularly so that water doesnt back up,RL
as a user i want the app to be energy efficient so that it doesnt drain my phones battery,RL
as a user i want the app to function well even during high traffic times so that my chats are not interrupted,RL
as a user i want the app to have a high level of uptime so that i can access banking services whenever i need them,RL
as a user i want the app to have high performance even during peak usage times so that my experience is not affected,RL
as a user i want the app to maintain a high level of performance even during major events like the finals so that i can access features without interruptions,RL
as a user i want the app to maintain high performance even during live broadcasts so that my experience is uninterrupted,RL
as a user i want the application to maintain high performance as it updates and expands,RL
as a user i want the platform to be responsive even during maintenance windows so that i can continue working,RL
as an online gamer i want the game to be free from latency issues so that my gaming experience is smooth and competitive,RL
as an online gamer i want the game to perform well even during peak usage times,RL
"As a manager, I want the system to handle a high number of users.",RL
"As a traveler, I want the booking confirmation to appear instantly, so that I feel confident my reservation is secure.",RL
"As a system administrator, I need optimized data processing during peak hours, so that system performance remains stable.",RL
"As a  journalist, I want article drafts to auto-save every 30 seconds so that I never lose work.",RL
"As a system administrator, I want to be able to configure the system to handle peak loads without performance degradation, so we can ensure a smooth user experience.",RL
"As a worker, I want the time-tracking app to save my clock-in immediately, so that I don‚Äö√Ñ√¥t miss hours.",RL
"As a student, I want exams to open on time during online tests, so that I don‚Äö√Ñ√¥t lose valuable minutes.",RL
"As a tester, I want load balancing to be implemented, so that no single server is overloaded.",RL
"As a user, I want the app to be tested thoroughly so that it works without issues.",RL
"As a  driver, I want car infotainment systems to block app installations while driving.",RL
"As a user, I want the application to be reliable and performant regardless of my location.",RL
"As a community organizer, I want community engagement platforms to be reliable for communication and event organization.",RL
"As a user, I want the application to work reliably and well no matter where I am so that I can depend on it.",RL
as a bank customer i want the banking app to be available 247 so that i can perform transactions anytime,RL
as a business owner i want the system to be reliable especially during the payroll processing period so that employees are paid without delays,RL
as a business professional i want the app to be reliable during business hours so that it doesnt disrupt my work,RL
as a cloud service user i want the service to be consistent in performance so that i can rely on it for my work,RL
as a cloud storage user i expect the service to be available whenever i need it with minimal downtime,RL
as a customer i want the app to be available 247 so that i can manage my finances at any time,RL
as a customer i want the app to be reliable especially during financial emergencies so that i can access my funds when needed,RL
as a customer i want the banking app to be consistently reliable during financial market fluctuations so that i can manage my investments effectively,RL
as a customer i want the service helpline to be available at all times so that i can get support when needed,RL
as a customer i want the service to be available 247 so that i can access it any time i need,RL
as a customer i want the service to be reliable during peak hours so that i can use it without disruptions,RL
as a data manager i want the system to accurately back up data so that no information is lost,RL
as a developer i want to make sure data exchanges are smooth so that information remains accurate during transfers,RL
as a environmentalist i want an ac unit to turn off when it reaches a certain temperature so that i will use less energy,RL
as a environmentalist i want the tech in the home to be as efficient as possible so that the energy lost due to heat can be minimized,RL
as a fan i want the app to be reliable especially during hightraffic events like derby matches so that i dont miss out on live updates,RL
as a frequent traveler i want the app to function well even with poor internet connectivity so that i can communicate without interruption,RL
as a healthcare provider i want the system to be reliable especially during critical care situations so that i can access patient information without interruptions,RL
as a healthcare provider we need reliable access to patient records at all times,RL
as a hospital it manager i want to ensure system uptime is maximized so that healthcare providers have continuous access to critical patient information,RL
as a hotel it manager i want to ensure the system is regularly backed up so that we do not lose reservation data,RL
as a hotel manager i want the system to be scalable so that it can accommodate growth and changes in our hotel operations over time,RL
as a librarian i want the system to back up data regularly so that no information is lost,RL
as a librarian i want the system to be reliable during peak hours so that service is not disrupted,RL
as a library member i want to be able to access to the platform at any time so that i can perform preservation,RL
as a mobile app user i want the app to maintain my session even if i switch to other apps temporarily,RL
as a parent i want the wifi to turn off at bedtime so that my kids wont be using it too late,RL
as a parent i want wifi to turn off at a certain hour so that children get off their devices,RL
as a payroll administrator i want the system to be reliable especially on payday so that employees receive their salaries without delay,RL
as a payroll administrator i want the system to have a backup and recovery solution so that payroll data is not lost in case of technical issues,RL
as a remote worker i need the software to remain operational even with intermittent internet connectivity,RL
as a remote worker i want the communication tool to function in areas of low bandwidth so that i stay connected everywhere,RL
as a remote worker i want the communication tool to work effectively in areas with low internet bandwidth,RL
as a researcher i want the platform to be regularly backed up so that my data is not lost in case of technical issues,RL
as a researcher i want the software to process data accurately so that my research is reliable,RL
as a software architect i need the system to be resilient to failures and capable of quick recovery,RL
as a software architect i need the system to recover quickly from any faults or crashes,RL
as a software architect i want the system to be scalable so that it can handle growing user demands,RL
as a staff member i want the emr to be consistent for all patients across all department so that patient safety is ensured,RL
as a streaming service user i want the platform to maintain high video quality even during peak hours so that my viewing experience is consistent,RL
as a student i need the educational platform to be consistently available especially during exam periods,RL
as a student i want the cms to be available during offhours so that i can study at any time,RL
as a system administrator i want the network to be faulttolerant so that services are not disrupted,RL
as a system i want to automatically recover from minor failures so that system uptime is maintained,RL
as a system i want to distribute resources dynamically so that services are always available,RL
as a system i want to handle system updates without impacting users so that they can continue using the service,RL
as a system operator i want the software to recover quickly from crashes so that downtime is minimized,RL
as a teacher i want the system to automatically back up data so that student information is not lost in case of a system failure,RL
as a teacher i want the system to be reliable during peak usage times such as report card season so that i can meet deadlines without technical issues,RL
as a teacher i want the system to be scalable so that it can accommodate more students and classes as the school grows,RL
as a umd employee i want the system to always be available so that i can access it whenever i need,RL
as a university department we want the cms to be scalable so that it can handle an increasing amount of content and users as the university grows,RL
as a user i expect the app to recover my data in case of an unexpected shutdown,RL
as a user i expect the system to be available at all times even during maintenance or updates,RL
as a user i expect the system to be consistently available especially during business hours,RL
as a user i expect the website to be available 999 of the time even during peak hours,RL
as a user i should be able to use the system at any given time,RL
as a user i want the app to be available and functioning properly at all times especially during emergencies,RL
