Requirement,Type
as a home occupant i want my thermostat to automatically adjust itself based on realtime weather updates so that my house can be more efficient with cooling and heating,PE
as a home occupant i want my work computer to turn on at a set time each day so that i am never late logging in for work,PE
as a home occupant i want surfaces to automatically detect and report sanitation levels in real time so that i know what i really need to clean and when,PE
as a home owner i want ceiling fans to come on automatically so that air will be circulated for constant temp and comfort,PE
as a home owner i want electronic usage monitor so that i can tell how much energy im using real time,PE
as a home owner i want lights that turn on and off automatically so that ligts are never left on wasting electricty,PE
as a home owner i want lights to automatically turn off when im not present so that i conserve energy efficiently,PE
as a home owner i want my daily purchase of home needs monitored and done automatically with the help of mobile application so that i can save time,PE
as a homemaker i want my robotic vacuum cleaner to start automatically twice a week so that my house is not dusty,PE
as a hospital administrator i want the system to provide realtime bed availability so that we can manage patient admissions effectively,PE
as a hospital administrator i want to track resource allocation in realtime so that we can optimize the use of our facilities and staff,PE
as a hospital billing specialist i want to process payments and insurance claims efficiently so that financial transactions are streamlined,PE
as a hotel staff member i want the system to handle group bookings efficiently so that we can manage large reservations without errors,PE
as a journalist i need the news app to update content in realtime,PE
as a journalist i want the news app to update content quickly so that i can stay informed with the latest news,PE
as a librarian i want the cataloging system to support bulk uploads of book information so that the process is efficient,PE
as a librarian i want the system to generate late fee reports automatically so that manual calculations are minimized,PE
as a library member i want to perform operations under 20 seconds,PE
as a member i want the library website to load quickly so that i can find information without delays,PE
as a member i want to search book by author so that i can quickly search for an authors book,PE
as a member i want to search book by name so that i can quickly search for a book,PE
as a member i want to search book by subject category so that i can quickly search for a subject,PE
as a mobile user i need the app to work efficiently without draining my phones battery,PE
as a nurse i want to quickly update patient records after each visit so that the information is always current and accurate,PE
as a parent i want to be able to view my childs academic progress in realtime so that i can stay informed and support their learning at home,PE
as a parent i want to be able to view realtime updates on my childs school bus location and estimated arrival time so that i can plan for pickup and dropoff,PE
as a payroll administrator i want the system to support batch processing of salaries so that i can manage payroll more efficiently,PE
as a payroll administrator i want to process salaries in batches so that i can manage payroll more efficiently for different departments,PE
as a platform user i want to collaborate on datasets in realtime so that i can work efficiently with my research team,PE
as a publisher i want to store my data quickly and easily online,PE
as a receptionist i want to view a realtime dashboard of daily hotel operations so that i can stay updated on occupancy checkins and checkouts,PE
as a recruiter i want to be able to manage job listings and applications efficiently,PE
as a referee i want to be able to record game events efficiently in realtime so that i do not have to waste any time,PE
as a referee i want to be connected to the system in realtime during the games so that i can provide the status updates as fast as possible without slowing me down or hindering my ability to manage the game,PE
as a remote worker i want the communication tool to work efficiently on limited data plans,PE
as a researcher i need the application to process and display large datasets efficiently,PE
as a side referee i want to have a mobilebased reporting tool so that i can report the game events in realtime,PE
as a staff i want to search book by author so that i can quickly search for an authors book,PE
as a staff i want to search book by name so that i can quickly search for a book,PE
as a staff i want to search book by subject category so that i can quickly search for a subject,PE
as a streaming service user i want videos to start playing quickly without buffering,PE
as a student i want quick page load times so that i can access documents swiftly without delay,PE
as a student i want the ability to upload multiple pages at once so that i can convert entire lecture notes in one go,PE
as a superuser i want to view users stats so that i can view in realtime how many users have visited my recycling center information and their recyclable waste,PE
as a system administrator i want to deploy filters runtime so that i can rollout filter dependent functionality efficiently throughout dtap,PE
as a system i want to handle multiple user requests efficiently so that performance is maintained during peak times,PE
as a system i want to route traffic dynamically so that the application remains responsive during heavy load,PE
as a system operator i need to be able to monitor system performance and identify issues quickly,PE
as a teacher i want to assess student progress in realtime during class so that i can provide immediate feedback and support,PE
as a team manager i want to be able to connect my system to the ifas so that i can report in realtime,PE
as a umd employee i want the system to start up within 2 minutes so that i can go to action fast when it is required,PE
as a umd employee i want to see a realtime simulation of the current traffic situation of wonderland so that i can take more informed decisions,PE
as a umd employee i want to see environmental measures taken at points in the city realtime on the map so that i know how the current traffic situation is affecting the environment,PE
as a umd employee i want to see the overall realtime co2 emissions so that i know how harmful the traffic situation is to the environment,PE
as a umd employee i want to see the realtime level of noise per measure point in the map so that i can see if the noise levels do not exceed the legal limits,PE
as a umd employee i want to see the realtime levels of air pollution per measure point in the map so that i can see it when a certain area is getting too polluted,PE
as a umd employee i want to see the realtime overall level of air pollution so that i know how harmful the traffic situation is to the environment,PE
as a user i expect the app to provide realtime notifications without delays,PE
as a user i expect the website to load within three seconds even during high traffic periods,PE
as a user i want the app to be reliable especially when tracking workouts in realtime so that i dont lose any important data,PE
as a user i want the app to have a quick response time so that i can perform banking activities without delays,PE
as a user i want the app to load quickly and provide information efficiently so that i can use it without delay,PE
as a user i want the app to load quickly on my phone so that i can start chatting immediately,PE
as a user i want the app to load quickly so that i can access content without frustration,PE
as a user i want the app to quickly process my uploaded documents so that i dont have to wait long for the conversion to complete,PE
as a user i want the app to send messages instantly so that my conversations feel realtime and engaging,PE
as a user i want the application to load quickly so that i can save time in accessing information,PE
as a user i want the banking app to load quickly so that i dont waste time waiting,PE
as a user i want the device to provide quick readings so that i can efficiently monitor my glucose levels multiple times a day,PE
as a user i want the navigation app to provide realtime traffic updates and alternative routes,PE
as a user i want the website to load quickly so that i can shop without waiting for pages to load,PE
as a user i want to be able to easily search for available parking spots in my desired location and time period,PE
as a user i want to be able to easily search for available rental cars in my desired location and time period,PE
as a user i want to be able to purchase replacement parts easily so that i can maintain the devices performance over time,PE
as a user i want to be able to see realtime stock prices and updates so that i can make informed investment decisions,PE
as a user i want to be able to view the availability of parking spots in realtime,PE
as a user i want to be able to view the train schedule and availability of seats in realtime so that i can make informed booking decisions,PE
as a user i want to be able to view the trains coach and seat availability in realtime so that i can make informed booking decisions,PE
as a user i want to be able to view the trains running status in realtime so that i can stay updated on any changes or delays,PE
as a user i want to find and download townlevel gis data,PE
as a user i want to view notifications in realtime so that i stay informed of important updates,PE
as a web developer i want the website to be responsive and load quickly on all devices,PE
as an admin i want to handle all users activities so that i can manage more efficiently,PE
as an administrator i want to have extensive logging so that i can easily and quickly reproduce errors,PE
as an ecommerce website owner i want the site to handle thousands of simultaneous users without slowing down,PE
as an ifa administration i want to allow 50000 people to have access on web application in the same time so that there will not be accessibility problems while logging into the system,PE
as an it technician i want to ensure minimal downtime during system maintenance,PE
as an online retailer i need the website to handle increased traffic during sales events,PE
as an online retailer i want my website to handle high traffic during holiday sales without crashing,PE
as an online shopper i want the ecommerce site to load quickly so that i can shop without delays,PE
as an online shopper i want the ecommerce website to load quickly on my mobile device so that i can shop on the go,PE
as an online store manager i want the website to handle high traffic during sales so that customer experience remains smooth,PE
as ifa i want all the information about the current games to be updated on the system portals in realtime so that the system portal is the only official source of information about the league and its games,PE
as ifa i want the referees realtime updates from the games to be prioritized over any other data flows in the system so that the updates are as fast as possible,PE
as ifa i want the system response time for fans team administration and ifa administration to not exceed 1 second so that to enhance the users experience,PE
as ifa i want to access the teams budgets in realtime instead of annually so that i monitor policy adherence,PE
as part of the throughput requirement the application should be able to process large files without any lag or delay,PE
as the ifa we want realtime digital recording of game event data by referees so that all the information we get is accurate reliable and true,PE
as the ifa we want to be able to see the specifications of the budgets of the teams in realtime so that we can monitor that they fulfill the regulations and policies,PE
as the main referee i want to have a mobilebased reporting tool so that i can report the game events in realtime,PE
"As a admin, I want efficient operations even under heavy load.",PE
"As a developer, I need the application to load responses promptly.",PE
"As a manager, I need the application to load responses promptly.",PE
"As a manager, I want efficient operations even under heavy load.",PE
"As a end-user, I want the system to handle 1000 concurrent users to handle high loads efficiently.",PE
"As a end-user, I want the application to optimize CPU and memory usage during peak hours.",PE
"As a developer, I need responses to be less than 2-second response time to ensure timely operations.",PE
"As a customer, I want the search results to appear within 2 seconds, so that I can quickly find what I need.",PE
"As an employee, I want the app to load smoothly during peak hours, so that I can complete tasks without delays.",PE
"As a manager, I want the system to handle multiple reports at the same time, so that I can analyze data efficiently.",PE
"As a teacher, I want assignments to be submitted without slowdowns, so that students meet deadlines.",PE
"As a user, I want video streaming to run without buffering, so that I enjoy uninterrupted content.",PE
"As an analyst, I want large data exports to finish quickly, so that I can share results with my team.",PE
"As a manager, I need the application to respond within 2 seconds for critical operations, so that I can maintain efficiency.",PE
"As a end-user, I want the system to support 100,000 users simultaneously, so that our business can scale.",PE
"As a business analyst, I want reports to be generated within 5 seconds, so that decision-making is faster.",PE
"As a database administrator, I need the system to handle up to 1TB of data efficiently, so that performance is not compromised.",PE
"As a security officer, I want real-time analytics to be available, so that we can act on insights immediately.",PE
"As a user, I want the login screen to load within 1 second so that I can access my account quickly.",PE
"As a shopper, I want the product page to display within 2 seconds so that I can view items without delay.",PE
"As a gamer, I want the game to start within 3 seconds so that I can begin playing immediately.",PE
"As a user, I want the chat messages to appear instantly so that I can have real-time conversations.",PE
"As a traveler, I want the flight search results to load within 2 seconds so that I can book tickets quickly.",PE
"As a student, I want the online class to start within 5 seconds so that I don't miss any part of the lecture.",PE
"As a user, I want the map to load within 1 second so that I can find locations quickly.",PE
"As a reader, I want the e-book to open within 1 second so that I can start reading immediately.",PE
"As a user, I want the notification to appear within 1 second so that I can stay informed in real-time.",PE
"As a driver, I want the GPS to recalculate the route within 1 second so that I can stay on track.",PE
"As a user, I want the photo to upload within 2 seconds so that I can share it quickly.",PE
"As a player, I want the leaderboard to update within 1 second so that I can see the latest rankings.",PE
"As a shopper, I want the shopping cart to update within 1 second so that I can see my added items.",PE
"As a reader, I want the article to load within 2 seconds so that I can start reading immediately.",PE
"As a user, I want the email to send within 1 second so that I can communicate quickly.",PE
"As a viewer, I want the video to start playing within 2 seconds so that I can watch without delay.",PE
"As a user, I want the calendar to update within 1 second so that I can see my new events immediately.",PE
"As a listener, I want the podcast to start playing within 2 seconds so that I can listen without delay.",PE
"As a  shopper, I want product images to load instantly so that I can browse without waiting.",PE
"As a  student, I want the exam portal to handle 500 logins at once so that I don‚Äôt get locked out during finals.",PE
"As a  traveler, I want hotel search results to appear in under 3 seconds so that I can plan trips faster.",PE
"As a  gamer, I want in-game menus to respond immediately so that I don‚Äôt miss multiplayer cues.",PE
"As a  doctor, I want lab results to display in under 2 seconds so that I can diagnose patients quickly.",PE
"As a  streamer, I want live chat messages to update without delays so that I can interact with viewers.",PE
"As a  teacher, I want quiz submissions to process instantly so that I can grade assignments faster.",PE
"As a  trader, I want real-time currency exchange rates so that I can execute trades accurately.",PE
"As a  farmer, I want weather alerts to refresh every 10 seconds so that I can protect crops from storms.",PE
"As a  customer, I want payment confirmations to appear in 5 seconds so that I know my order is placed.",PE
"As a  librarian, I want catalog searches to return results instantly so that patrons find books quickly.",PE
"As a  parent, I want the family calendar app to load in 1 second so that I can schedule activities smoothly.",PE
"As an  event planner, I want attendee check-ins to process 200 people/minute so that lines move faster.",PE
"As a  photographer, I want photo thumbnails to generate instantly so that I can sort albums efficiently.",PE
"As an  HR manager, I want employee directories to load in under 2 seconds so that I can find contacts quickly.",PE
"As a  driver, I want traffic updates to refresh every 15 seconds so that I can avoid jams.",PE
"As a  scientist, I want data charts to render in under 3 seconds so that I can analyze trends faster.",PE
"As a  retailer, I want inventory counts to update in real time so that I can restock items promptly.",PE
"As a  pilot, I want flight dashboards to display fuel levels without lag so that I can monitor safety.",PE
"As a  chef, I want recipes to scale for 1 or 10 servings so that I can cook for any group.",PE
"As a  shopper, I want the website to load product pages in under 2 seconds so that I can browse efficiently without frustration.",PE
"As a  student, I want the exam portal to handle 1,000 simultaneous users without crashing so that I can take my test without interruptions.",PE
"As a  traveler, I want flight search results to appear instantly so that I can compare options quickly and book my trip.",PE
"As a  gamer, I want multiplayer matches to run smoothly even with 50 players so that I can enjoy the game without lag.",PE
"As a  doctor, I want patient records to load in under 1 second so that I can provide timely care during consultations.",PE
as a frequent traveler i want the app to adjust its features based on my current location and language,PO
as a user i want to be able to access news articles from different regions,PO
as a home occupant i want my music and videos to sync across devices all over the house so that i will not have to manually transfer my entertainment between devices,PO
as a nurse i want to have mobile hospital devices that automatically transfer the data it measured to the patients medical file so that i do not have to insert the data manually,PO
as an univitservice i want to be able to export all data to a different system so that i am not tied into one system which may not be the most appropriate at some point in the future,PO
"As a end-user, I want the application to run on various platforms.",PO
"As a end-user, I want to ensure the application works on different device types.",PO
"As a student, I want the app to work on both my laptop and tablet, so that I can study from anywhere.",PO
"As a team member, I want documents to open correctly on any device, so that I can collaborate easily.",PO
"As a content creator, I want my media files to display consistently across different platforms, so that my work looks professional.",PO
"As a customer, I want digital receipts to be readable on all devices, so that I can access them anywhere.",PO
"As a manager, I want the system to support both Windows and MacOS, so that it can be used across different platforms.",PO
"As a database administrator, I need the system to handle various device screen sizes, so that users have a consistent experience.",PO
"As a gamer, I want the game to work on different consoles so that I can play with friends on any platform.",PO
"As a gamer, I want the game to support cross-platform play so that I can compete with friends on any device.",PO
"As a shopper, I want the app to support different currencies so that I can shop internationally.",PO
"As a  teacher, I want lesson plans to open on iPads and laptops so that I can teach from any device.",PO
"As a  teacher, I want lesson plans to open on both Windows and Mac so that I can work from any device.",PO
"As a  student, I want my notes to sync across my laptop, tablet, and phone so that I can study anywhere.",PO
"As a  student, I want my e-learning platform to work offline so that I can study without internet access.",PO
"As a manager, I want the system to run on both AWS and Azure cloud platforms.",PO
"As a teacher, I want the online learning platform to be accessible from different browsers (Chrome, Firefox, Safari).",PO
"As a patient, I want to be able to access my medical records from any healthcare provider's system.",PO
"As a social media user, I want to be able to share content across different social media platforms.",PO
"As a news reader, I want news websites to be accessible on different devices (desktops, laptops, tablets, smartphones).",PO
"As a social media user, I want to share my posts on all my social media accounts so that I can reach a wider audience.",PO
"As a news reader, I want to read the news on any device so that I can stay informed regardless of where I am.",PO
"As a student, I want the app to sync between my phone and laptop, so that I can study on any device.",PO
"As a professional, I want my presentation to open correctly on both Windows and Mac, so that I avoid technical issues.",PO
"As a job applicant, I want my resume to display well in different formats, so that hiring managers see it properly.",PO
"As a visitor, I want museum app features to adapt to my device type, so that I get an optimal experience.",PO
"As a traveler, I want my travel itinerary to sync on my laptop and phone, so that I can access it anywhere.",PO
as a developer i want the software to be easily installable on various operating systems,PO
as a donor i want the app to provide a consistent experience across all devices so that i can switch between them as needed without confusion,PO
as a business owner i want the salary management system to be accessible from different platforms so that i can manage payroll from any device,PO
as a cloud service user i need to access the service from various devices and locations,PO
as a cloud service user i want the service to be adaptable to different devices so that i can access it on any device i use,PO
as a doctor i want the data stored on the old management systems to be transferred to the new core management system so that i do not lose any data,PO
as a doctor i want to access patient data on my mobile device so that i can make informed decisions while on the move,PO
as a doctor i want to be able to use the hospital management system on a mobile device so that i can access the system no matter my current location,PO
as a doctor i want to have access to all the functionalities on a mobile device that i also have access to on a personal computer,PO
as a fan i want to access the system on my phone so that i can access it wherever i am,PO
as a fan i want to be able to access the system through a mobile app so that i can access it anywhere,PO
as a freelance worker i want to install and use the application on different devices i own,PO
as a frequent traveller i want the banking system to have a large network of atms and branches in different countries so that i can easily access my money while abroad,PO
as a global company employee i want the software to support various currencies and languages,PO
as a global user i want the app to support multiple languages so that i can use it in my native language,PO
as a gymgoer i want to access the app across multiple devices so that i can log workouts from my phone tablet or computer,PO
as a healthcare provider i want to access patient diagnostics and lab results on my mobile device so that i can make timely decisions,PO
as a home owner i want device that plays music wirelessly from any device so that music and playlists can easily be listened to,PO
as a match official i want to access the system on my phone so that i can access it on the field or while i am traveling to the game,PO
as a mobile app user i want the app to be usable in different network conditions so that i can access it anywhere,PO
as a multinational company employee i need the software to be usable in different languages and regions,PO
as a music listener i want to be able to access my music library across multiple devices so that i can listen to my music wherever i am,PO
as a nurse i want the data stored on the old management systems to be transferred to the new core management system so that i do not lose any data,PO
as a nurse i want to access patient care plans and medication schedules on my mobile device so that i can provide care efficiently while on the move,PO
as a nurse i want to view a patients medical record on my mobile phone so that i can check his blood type quicker than using a computer,PO
as a party thrower i want surround sound connected to wifi so that i can stream music in any room,PO
as a patient i want to be able to access and view my emr on a mobile device,PO
as a patient i want to be able to access my medical record from my mobile device so that i can review measurement and test results,PO
as a patient i want to be able to request new prescriptions on a mobile device,PO
as a patient i want to be able to schedule an appointment on a mobile device,PO
